Name the second largest continent.;Africa
Why do we call Africa a plateau continent?;Africa is a plateau continent because most of it is 3,000 feet above sea level.
Name the world’s largest desert.;Sahara
What provides excellent farmland in northern Egypt?;The Nile River
What is the large river in West Africa?;The Niger River
Name the main products of medieval Africa:;gold, salt, copper, iron, and slaves
Why was medieval Africa isolated?;The plateau and Sahara Desert made it difficult for outsiders to venture into Africa.
What enabled Europeans to explore Africa?;Inventions like the compass, astrolabe, and better ships enabled Europeans to explore Africa.
